order_id,customer_id,date,nearest_warehouse,shopping_cart,order_price,delivery_charges,customer_lat,customer_long,coupon_discount,order_total,season,is_expedited_delivery,distance_to_nearest_warehouse,latest_customer_review,is_happy_customer
ORD141721,ID1888086800,2019-01-10,Thompson,"[('Candle Inferno', 1), ('iStream', 2)]",730.0,88.49,-37.7999733,144.96254009999996,5,781.99,Summer,True,1.9622,counterfeit fake,False
ORD239724,ID0634783575,2019-09-19,Thompson,"[('iStream', 1), ('Thunder line', 2), ('Toshika 750', 1), ('Lucent 330S', 2)]",11290.0,101.57,-37.8123454,144.9368391,10,10262.57,Spring,True,0.9004,wasn't sure if i'd like this product but after having it for a little while i want one in every room! my daughter is constantly asking iassist how to spell words. we've barely tapped into all the things this product is capable of and i'm looking forward to learning all of its capabilities!,True
ORD386348,ID0591430541,2019-07-24,Nickolson,"[('Thunder line', 1), ('Toshika 750', 1)]",6500.0,73.98,-37.8175146,144.9672298,0,6573.98,Winter,True,0.2369,"besides being fun, it also has many practical aspects--a real bonus for those with vision issues!",True
ORD107851,ID3210158652,2019-05-01,Thompson,"[('Toshika 750', 2), ('Olivia x460', 1)]",9865.0,64.32,-37.8083206,144.9482751,15,8449.57,Autumn,False,0.496,"five stars amazing cell phone, my daughter like it so much.",True
ORD195120,ID0387153035,2019-12-24,Thompson,"[('Olivia x460', 1), ('Thunder line', 1), ('pearTV', 1), ('Candle Inferno', 2)]",10575.0,88.72,-37.8092723,144.94574440000005,0,10663.72,Summer,True,0.3961,does the trick. this is a good tablet for the price.,True
ORD308971,ID1449496101,2019-03-03,Nickolson,"[('Toshika 750', 2), ('iAssist Line', 2), ('pearTV', 1), ('Universe Note', 2)]",26300.0,82.34,-37.8239706,144.98478799999995,5,25067.34,Autumn,True,1.4674,upgraded from s5 wish it still had the ir emitter to use as a universal remote,True
ORD434031,ID1985429677,2019-06-24,Bakers,"[('Candle Inferno', 1), ('Universe Note', 1), ('Toshika 750', 1)]",8200.0,52.94,-37.8000238,144.987617,10,7432.94,Winter,False,1.2951,i just hate when stuff doesn't work peace of crap should have bought a new one .. you get what you pay for.. sd card slot does not work and the phone randomly shuts down. i just hate when stuff doesn't work peace of crap.....,False
ORD395522,ID1492416114,2019-04-21,Thompson,"[('iAssist Line', 1), ('Universe Note', 1), ('Olivia x460', 1)]",6900.0,83.81,-37.8019171,144.9571681,10,6293.81,Autumn,True,1.4908,it is so good so good i love it works were ever u ... it is so good so good i love it works were ever u sit in ur house so good,True
ORD173855,ID0580172911,2019-05-14,Thompson,"[('iAssist Line', 1), ('iStream', 1), ('Alcon 10', 2), ('Toshika 750', 1)]",24595.0,82.89,-37.802179,144.9346166,15,20988.64,Autumn,True,1.6013,"this stuff is fantastic i think this product is very good and useful, i like it a lot",True
ORD179014,ID4518401169,2019-01-07,Thompson,"[('iAssist Line', 1), ('Thunder line', 2)]",6585.0,89.9,-37.8072367,144.9495695,15,5687.15,Summer,True,0.6439,"buy it superb phone, especially at this price. looks great, has perfect ergonomics, super fast, no bloatware, has dual sim. by far the best phone i've owned.",True
ORD095816,ID3366919136,2019-08-29,Bakers,"[('Thunder line', 1), ('Toshika 750', 1), ('Alcon 10', 1)]",15450.0,83.62,-37.8121826,145.01638789999996,5,14761.12,Winter,True,1.8764,awesome! easy set up. linked right up with my nexia home automation.,True
ORD410069,ID2177124606,2019-09-05,Nickolson,"[('Toshika 750', 1), ('iAssist Line', 2)]",8770.0,102.05,-37.8147548,144.9615148,0,8872.05,Spring,True,0.8259,five stars great product !! so far working like new love it,True
ORD236168,ID1449266770,2019-11-24,Bakers,"[('Toshika 750', 2), ('Candle Inferno', 1), ('iStream', 2), ('Lucent 330S', 2)]",11830.0,104.7,-37.8163883,144.9838774,0,11934.7,Spring,True,1.2261,"love this phone i absolutely love this phone. perfect screen size and razor sharp resolution, epic camera, fantastic battery life. i love how it feels in my hand and obviously it's a beautiful looking phone. it is hands down the best alcon, and i've had all of them.",True
ORD193838,ID2312383361,2019-10-05,Bakers,"[('iAssist Line', 1), ('iStream', 2), ('Candle Inferno', 2)]",3385.0,65.22,-37.8080834,145.0088378,5,3280.97,Spring,False,1.2154,this tablet could be so much better if the apps actually worked decently. the built in digico pieces for gold members is great and work flawlessly. but it's not enough to overcome the terrible app behavior and countless freezes.  they need to take a lesson or two from pear.,False
ORD419580,ID6167236643,2019-11-25,Thompson,"[('Toshika 750', 2), ('pearTV', 2)]",21260.0,104.8,-37.8135903,144.9572938,15,18175.8,Spring,True,0.905,"good phone this huawei smart phone is very good, it is better price than olivia s9 plus, all function are same.",True
ORD183145,ID2187874242,2019-11-28,Nickolson,"[('Alcon 10', 1), ('Universe Note', 1)]",12400.0,84.78,-37.8144896,144.9660863,15,10624.78,Spring,True,0.5493,"garbage. do not purchase bought a refurbished phone olivia s7 edge. the phone had no voicemail app, had a pink line down the screen, warranty was up and one day after it was up the phone turns on, turns off, turns on, turns off and never comes back on. complete waste of money",False
ORD275882,ID3204395233,2019-07-21,Thompson,"[('Universe Note', 1), ('Olivia x460', 2), ('Candle Inferno', 2), ('Alcon 10', 2)]",24660.0,76.56,-37.8067098,144.9490039,25,18571.56,Winter,True,0.6853,wonderful phone i'm in love with this phone,True
ORD186209,ID6167489375,2019-09-26,Thompson,"[('iAssist Line', 2), ('iStream', 1), ('Olivia x460', 1)]",5825.0,79.45,-37.8076285,144.95817119999995,25,4448.2,Spring,False,1.1264,cheap and just as good as any flagship. no compromises for me love it so far,True
ORD415061,ID0711331285,2019-06-13,Thompson,"[('Olivia x460', 2), ('Toshika 750', 1), ('pearTV', 2), ('Lucent 330S', 2)]",21850.0,78.72,-37.8070369,144.9570793,10,19743.72,Winter,True,1.0811,fast and good good,True
ORD195214,ID6167344365,2019-06-13,Nickolson,"[('iAssist Line', 1), ('Olivia x460', 2), ('Lucent 330S', 1)]",5905.0,74.77,-37.8147838,144.96885930000005,15,5094.26,Winter,True,0.4286,tablet is wonderful for young kids. there's ways to switch it to kid friendly,True
ORD441668,ID0296027574,2019-05-05,Thompson,"[('Alcon 10', 1), ('pearTV', 1), ('iAssist Line', 2), ('Lucent 330S', 1)]",20940.0,64.88,-37.8122757,144.9447004,15,17863.88,Autumn,False,0.2129,xp lumia 920 i have had my phone for a few weeks now and i love it. it came on time and works great. wasn't sure if it would come new and how it would work. so far no problems and i am glad i made the purchase!,True
ORD045780,ID0708717121,2019-10-09,Thompson,"[('Candle Inferno', 1), ('pearTV', 2), ('Universe Note', 2), ('Toshika 750', 2)]",28590.0,102.3,-37.8062298,144.9580375,10,25833.3,Spring,True,1.2021,how easy if was to set up.,True
ORD343328,ID6167344548,2019-09-13,Nickolson,"[('Thunder line', 1), ('Olivia x460', 2), ('Toshika 750', 2)]",13270.0,75.48,-37.81309210000001,144.9708751,0,13345.48,Spring,False,0.6235,its ok but its ok but i don't what happend with this cell phone especific with the whatsapp application the messages are delayed for very long time. that is why i score with 3 stars.,True
ORD466168,ID0777753008,2019-10-31,Thompson,"[('Alcon 10', 1), ('Candle Inferno', 1), ('Universe Note', 2), ('iStream', 2)]",16580.0,80.02,-37.8059881,144.95584409999995,5,15831.02,Spring,False,1.0721,four stars awesome!,True
ORD098569,ID0128982338,2019-03-01,Nickolson,"[('Universe Note', 1), ('Toshika 750', 1), ('iStream', 1)]",7920.0,78.6,-37.8173354,144.9622079,15,6810.6,Autumn,True,0.6608,purchased due to reviews and in sale. so far easy to use.,True
ORD463144,ID6167236648,2019-12-14,Nickolson,"[('Universe Note', 2), ('Toshika 750', 1), ('Alcon 10', 1)]",20170.0,77.47,-37.8129068,144.9596814,0,20247.47,Summer,False,1.0743,"amazing! amazing phone! amazing!! the only complaint are peoples complaints, its too big or they can hear me because i have a bad habit of taking away from the mic. i had this phone for 10 months and i think i'm gonna make it offical and marry it!",True
ORD023051,ID2383211198,2019-11-24,Nickolson,"[('Olivia x460', 1), ('Toshika 750', 1), ('iStream', 1), ('Thunder line', 2)]",10055.0,101.82,-37.8095398,144.9637886,25,7643.07,Spring,True,1.1282,"five stars all good, the item works perfectly! thank you.",True
ORD223159,ID0767733190,2019-02-06,Nickolson,"[('Candle Inferno', 2), ('Alcon 10', 1), ('Universe Note', 2)]",16710.0,66.13,-37.8042044,144.9714721,25,12598.63,Summer,False,1.6108,"not quite there. well this is a decent device, but kinda flimsy. google assistant doesn't work on voice command. tried to work around. phone call keeps on going back and forth among bluetooth and handset. laga sometimes. can't use sd card as internal. doesn't get oreo update. i mean if you have to settle go for lucentrola .",False
ORD318403,ID0581784158,2019-03-14,Thompson,"[('Lucent 330S', 1), ('Alcon 10', 2)]",19130.0,64.7,-37.8077414,144.9397185,0,19194.7,Autumn,False,0.8481,the best! exactly as described. i'm very pleased with this phone!,True
ORD374545,ID0596044684,2019-02-06,Bakers,"[('Alcon 10', 2), ('iStream', 1)]",18050.0,84.97,-37.79979229999999,144.9762253,10,16329.97,Summer,False,2.0211,buy this without worries very good to nearly excellent condition,True
ORD077587,ID0723965015,2019-07-04,Bakers,"[('Toshika 750', 1), ('iStream', 1), ('pearTV', 1)]",10780.0,63.33,-37.8040907,145.0051631,10,9765.33,Winter,True,1.0932,need digico account and bank account to use tablet. bank card should be verified. cheap product with terrible graphic. i returned that next day. totally waste of money.,False
ORD209527,ID3121590188,2019-05-19,Bakers,"[('Olivia x460', 2), ('Lucent 330S', 1)]",3680.0,79.38,-37.798734,145.0002236,15,3207.38,Autumn,True,1.3283,three stars liked my s-111 a lot better.,True
ORD268419,ID2935371922,2019-12-17,Bakers,"[('Toshika 750', 2), ('pearTV', 2)]",21260.0,82.74,-37.8249556,144.992358,15,18153.74,Summer,False,1.6843,"for the price, this phone is ridiculous for the price, this phone is ridiculous. works fine, screen is pretty big, picture is pretty clear, and the battery genuinely lasts a week. i don't see why anyone would buy a ""middle of the road"" android phone. this is just too good for the price.",True
ORD421638,ID2948774583,2019-06-03,Nickolson,"[('iStream', 2), ('pearTV', 2), ('Universe Note', 2), ('iAssist Line', 1)]",22045.0,66.66,-37.8080995,144.97115630000005,10,19907.16,Winter,False,1.1768,mi wife loves it. bought this for my wife as a present and she really loves it. the battery last all day.,True
ORD248019,ID0581751028,2019-05-08,Thompson,"[('iAssist Line', 2), ('Thunder line', 1)]",6630.0,82.96,-37.8043845,144.93008469999995,0,6712.96,Autumn,True,1.7557,great phone great phone i am still using that and learning more and more about it everyday i still have it and have gone through one case and put a new case on,True
ORD377377,ID3191033048,2019-05-13,Nickolson,"[('Lucent 330S', 2), ('Toshika 750', 2), ('iStream', 1), ('Thunder line', 1)]",13430.0,77.94,-37.8111043,144.9691889,10,12164.94,Autumn,True,0.8345,"great phone good tech, not too pricey.",True
ORD199897,ID6167413263,2019-04-28,Nickolson,"[('iAssist Line', 2), ('Olivia x460', 2), ('Candle Inferno', 1), ('iStream', 2)]",7630.0,64.15,-37.8143261,144.96328640000004,10,6931.15,Autumn,False,0.7275,"best phone i love this phone! the color is better and brighter than my older phone. battery lasts longer than expected. the processor is way faster than the older phone. simply put, best phone on the market in my opinion.",True
ORD074381,ID6197211482,2019-10-14,Thompson,"[('Olivia x460', 1), ('pearTV', 1)]",7535.0,80.94,-37.8142946,144.9328163,15,6485.69,Spring,False,1.2663,"recommended excellent product, i've been using it for some days and i think is awesome, no lag, definition is great, the construction is amazing the same as the price.",True
ORD191239,ID2314545794,2019-12-15,Bakers,"[('Candle Inferno', 2), ('Toshika 750', 2), ('pearTV', 2), ('Thunder line', 2)]",26480.0,79.16,-37.8045461,144.9876882,15,22587.16,Summer,True,0.899,"telefono muy feo. los iconos de las aplicaciones son muy feos, y viene com muchas aplicaciones pre-instaladas de juegos que a mi no me agradan por que yo no uso juegos. el telefono es para mi una herramienta de trabajo y de comunicacion. ahi se los devuelvo.",False
ORD408257,ID0441031279,2019-09-25,Thompson,"[('Toshika 750', 1), ('Olivia x460', 2), ('iAssist Line', 1)]",8995.0,100.88,-37.81288789999999,144.9374815,0,9095.88,Spring,True,0.8435,five stars spot on and very nice!,True
ORD002180,ID0571731117,2019-07-10,Thompson,"[('Alcon 10', 1), ('Toshika 750', 1)]",13270.0,67.44,-37.8243114,144.94396319999996,10,12010.44,Winter,False,1.324,"i bought this for my 8 year old. i was a great buy. the price was affordable compared to other tablets on the market and e 8"" screen is perfect. another great buy!!!",True
ORD356919,ID5968588316,2019-03-04,Thompson,"[('Candle Inferno', 2), ('iAssist Line', 1), ('Alcon 10', 2), ('pearTV', 1)]",27295.0,49.68,-37.8209083,144.94230159999995,0,27344.68,Autumn,False,1.008,one star not new phone.,False
ORD479779,ID0571731179,2019-03-29,Thompson,"[('Universe Note', 1), ('Lucent 330S', 2), ('Toshika 750', 2)]",14550.0,67.09,-37.8239722,144.9436789,25,10977.86,Autumn,False,1.2926,great except... great phone only negative battery does not last long at all,True
ORD194409,ID0702451781,2019-10-16,Thompson,"[('iAssist Line', 1), ('Alcon 10', 2), ('Candle Inferno', 2), ('Thunder line', 1)]",23165.0,65.0,-37.80447520000001,144.94263610000004,10,20913.5,Spring,False,0.9924,should of did a little more research. do not like the ads on the start screen.,False
ORD285633,ID3094966836,2019-12-07,Thompson,"[('Lucent 330S', 1), ('pearTV', 1)]",7540.0,99.1,-37.8004668,144.9486426,10,6885.1,Summer,True,1.3658,good everything,True
ORD051328,ID5058108327,2019-12-24,Nickolson,"[('iStream', 1), ('iAssist Line', 2), ('pearTV', 2), ('Alcon 10', 2)]",35120.0,69.68,-37.8222105,144.9679533,25,26409.68,Summer,False,0.4263,"i used daily and its works awesome, the price and performance are good i suggested to my friends , bought last yrs as well gave to my dad, he loves it.",True
ORD463930,ID1960476797,2019-06-14,Thompson,"[('pearTV', 2), ('Candle Inferno', 1), ('Toshika 750', 1), ('iStream', 2)]",17670.0,76.44,-37.8173885,144.9526609,10,15979.44,Winter,True,0.7193,google phone 👏👏 my daughter loved his new phone.. even though is a used one.. is working efficiently and we are glad it doesn't take hours to get charged. i recommend everyone to buy a pixel 2!,True
ORD080718,ID4893634023,2019-01-17,Thompson,"[('Thunder line', 2), ('Alcon 10', 2), ('pearTV', 1)]",28570.0,100.78,-37.811591,144.9298709,5,27242.28,Summer,True,1.5172,"worth worth the money, way better than my old alcon x.",True
ORD218433,ID0578077318,2019-11-18,Thompson,"[('Thunder line', 1), ('Toshika 750', 1), ('Universe Note', 2)]",13400.0,93.56,-37.8194126,144.9320645,5,12823.56,Spring,True,1.5178,"shipped broken phone. says it's refurbished, but gps doesn't work after two reinstalls. waste of my time. beware.",False
ORD248533,ID0746912626,2019-05-24,Nickolson,"[('Candle Inferno', 2), ('Lucent 330S', 1), ('Alcon 10', 2)]",19990.0,80.9,-37.82545,144.9846594,0,20070.9,Autumn,True,1.5321,great phone. so far i love this phone. had it about a year. great quality does everything i need and more. only thing i don't love it i wish i could delete some of the apps that came on the phone that i will never use. love the rubberized case.,True
ORD118692,ID0635499737,2019-10-29,Thompson,"[('Alcon 10', 1), ('pearTV', 1)]",15260.0,100.22,-37.8153397,144.940552,5,14596.07,Spring,True,0.6454,perfectt! great product. easy activation.,True
ORD458234,ID0250774472,2019-06-24,Bakers,"[('Olivia x460', 1), ('Universe Note', 1), ('pearTV', 1)]",10985.0,56.24,-37.8179658,145.01315590000004,5,10491.99,Winter,False,1.8088,horrible product horrible product,False
ORD308120,ID0581710139,2019-04-12,Thompson,"[('iAssist Line', 1), ('Alcon 10', 2), ('pearTV', 2)]",32745.0,69.67,-37.8050725,144.9277251,25,24628.42,Autumn,False,1.9,perfect gift love it,True
ORD042784,ID0030948022,2019-04-30,Bakers,"[('Thunder line', 2), ('iAssist Line', 2), ('Alcon 10', 2)]",26710.0,63.64,-37.8147119,145.0022753,15,22767.14,Autumn,False,0.8119,"excellent phone, great deal excellent condition, no scratches, looks brand new. battery at 100% health/maximum capacity.",True
ORD440394,ID0664322640,2019-10-16,Thompson,"[('Candle Inferno', 2), ('Thunder line', 2)]",5220.0,98.29,-37.8154782,144.95394,10,4796.29,Spring,True,0.6802,"flip flop! - but acceptable at this time and age, this phone is not practical. it seems i paid too much! but it works and it was new.",True
ORD081386,ID6167236664,2019-06-30,Nickolson,"[('iStream', 1), ('pearTV', 1), ('Candle Inferno', 2), ('Toshika 750', 1)]",11640.0,77.08,-37.8107102,144.9672351,5,11135.08,Winter,True,0.9,my boyfriend loves his new phone i went half on this with my boyfriend and now he won't stop thanking me.,True
ORD492112,ID0746924730,2019-08-04,Nickolson,"[('iStream', 2), ('Olivia x460', 2), ('Candle Inferno', 2)]",3610.0,64.43,-37.8241367,144.9848488,5,3493.93,Winter,True,1.4799,to much scratchiest on the phone!!!. to much scratchiest on the phone!!!.,False
ORD439652,ID2941600080,2019-09-04,Nickolson,"[('iAssist Line', 2), ('pearTV', 1), ('Olivia x460', 2)]",13210.0,73.15,-37.8223921,144.9701332,10,11962.15,Spring,False,0.4258,five stars good,True
ORD262983,ID0711331434,2019-07-23,Thompson,"[('Olivia x460', 2), ('Thunder line', 2)]",6810.0,66.91,-37.807266,144.9574618,10,6195.91,Winter,False,1.0944,"looks new, works fine i removed the sim from the old broken phone, added it to this one and it worked. this one looks brand new. very happy.",True
ORD210397,ID0123349509,2019-06-20,Thompson,"[('Toshika 750', 2), ('iAssist Line', 1)]",10865.0,85.79,-37.7993535,144.92775580000003,15,9321.04,Winter,True,2.2547,five stars perfect!,True
ORD459310,ID0304186957,2019-12-06,Nickolson,"[('pearTV', 1), ('Toshika 750', 1), ('iAssist Line', 2)]",15080.0,83.27,-37.8260179,144.9827282,25,11393.27,Summer,True,1.4216,"unlocked? this phone says it is unlocked, but it won't work with verizon.",False
ORD475274,ID6167285754,2019-10-07,Thompson,"[('iStream', 1), ('Lucent 330S', 1), ('pearTV', 1), ('Toshika 750', 2)]",16330.0,99.5,-37.8130719,144.9512926,0,16429.5,Spring,True,0.3737,cool but expensive it is a great fone..,True
ORD229776,ID0781082267,2019-09-12,Bakers,"[('Olivia x460', 2), ('Alcon 10', 2), ('pearTV', 1), ('Lucent 330S', 1)]",27890.0,87.09,-37.8228581,145.0141013,15,23793.59,Spring,False,2.1916,"refubished turns out good i bough it refurbished from digico, and i was scared for some bad reviews i read, but everthing was ok with my phone. the only cons it was that came with a generic charger",True
ORD176232,ID4735688724,2019-02-18,Thompson,"[('Toshika 750', 1), ('Candle Inferno', 1), ('Universe Note', 1), ('Lucent 330S', 2)]",10660.0,95.45,-37.80396629999999,144.94932340000005,5,10222.45,Summer,True,0.9893,great great phone for reasonable price. love it,True
ORD259932,ID3085953524,2019-11-21,Bakers,"[('Candle Inferno', 1), ('Toshika 750', 1)]",4750.0,83.13,-37.8236459,144.98788269999997,25,3645.63,Spring,False,1.6512,"love olivia! love my phone, i'm on it rite now!",True
ORD275837,ID0746912597,2019-01-03,Nickolson,"[('Alcon 10', 1), ('Universe Note', 2), ('Candle Inferno', 1)]",16280.0,99.35,-37.824325,144.98447439999995,15,13937.35,Summer,True,1.4591,this is the best phone in my life love it,True
ORD394816,ID5402983335,2019-02-03,Nickolson,"[('iAssist Line', 2), ('Universe Note', 1), ('Olivia x460', 2)]",10350.0,88.87,-37.8191281,144.9651789,0,10438.6,Summer,True,0.389,"everything you should ever need the reviews are true, at&t and olivia have created possibly the best phone i've ever owned - keep up the good work!",True
ORD460925,ID0593475965,2019-01-12,Nickolson,"[('Lucent 330S', 2), ('Candle Inferno', 1), ('pearTV', 1), ('Olivia x460', 1)]",10425.0,79.59,-37.8105417,144.963598,0,10504.59,Summer,True,1.0381,stolen phone! used-goods sent me a faulty item whose imei determined that it was stolen.,False
ORD184632,ID0277117986,2019-12-01,Thompson,"[('iAssist Line', 2), ('Lucent 330S', 2), ('Toshika 750', 2)]",15550.0,83.3,-37.8238015,144.94760259999995,25,11745.8,Summer,True,1.2397,do not buy from wireless place bad choice. camera is blurry. it's a used phone or its defective and the seller did not say anything even after i sent them a message.,False
ORD179911,ID0580001165,2019-07-10,Thompson,"[('iStream', 1), ('pearTV', 1)]",6460.0,81.17,-37.8071465,144.9336525,10,5895.17,Winter,True,1.3307,great customer service arrived in a couple days as expected and delivered untouched. brand new phone and works very well. price was great and if i ever needed another phone i would order from them again.,True
ORD232096,ID0248266238,2019-11-20,Nickolson,"[('Universe Note', 1), ('Lucent 330S', 2)]",5910.0,110.57,-37.8273825,144.9879984,5,5725.07,Spring,True,1.8942,"beautiful phone, works seamlessly! so far i love it! i have upgraded from a lucent g6 so i'm used to how these work. i do wish lucentrola had their own stock music app though. i can't stand using google play music or digico music for my tons of some that i already have stored on my micro sd card.",True
ORD491013,ID0591354267,2019-05-14,Nickolson,"[('Lucent 330S', 2), ('iAssist Line', 2), ('iStream', 1)]",7060.0,81.36,-37.8226659,144.9554904,15,6082.36,Autumn,True,1.3168,still learning this phone seems to be as durable as suggested by ads has been hard to find a hard case for it the jury is still out but i expect that it will preform well i will get another one soon still learning the phone limits,True
ORD241631,ID2176972931,2019-12-16,Bakers,"[('Toshika 750', 1), ('iStream', 1), ('pearTV', 1)]",10780.0,80.18,-37.8042708,145.01116059999995,15,9244.95,Summer,False,1.5391,i really enjoy being able to just make a request  for my favorite music and it happens i have no complaints at this time...,True
ORD412017,ID3293340291,2019-04-07,Nickolson,"[('Toshika 750', 1), ('iAssist Line', 1), ('Thunder line', 2), ('iStream', 2)]",11205.0,80.05,-37.8242946,144.98214840000003,25,8483.8,Autumn,True,1.2766,i love this phone! i've always used and loved olivia phones. this so far is my favorite. absolutely love all the features and ease of use.,True
ORD022699,ID2189143648,2019-07-01,Thompson,"[('Toshika 750', 2), ('Universe Note', 2)]",15540.0,61.71,-37.809629,144.9555264,15,13270.71,Winter,True,0.8173,locked att phone. useless to me the phone is locked. i am not an at&t customer so the phone is useless to me,False
ORD439219,ID2325395489,2019-12-30,Thompson,"[('Thunder line', 2), ('iAssist Line', 1)]",6585.0,97.58,-37.808355,144.9599144,10,6024.08,Summer,True,1.2277,five stars great,True
ORD290803,ID1449431395,2019-09-19,Nickolson,"[('Thunder line', 2), ('iAssist Line', 1)]",6585.0,101.27,-37.8129475,144.9783171,5,6357.02,Spring,True,0.9947,the inferno is an excellent table for many basic tasks.,True
ORD173801,ID6167489423,2019-03-06,Thompson,"[('iStream', 2), ('Lucent 330S', 1)]",1530.0,79.79,-37.810968,144.9586967,5,1533.29,Autumn,True,1.0401,"amazing phone the phone came with a small scratch on the screen. disappointed about that, but moved on and got it activated on my carrier (sprint). the phone, in general, is absolutely amazing. beautiful screen and fantastic battery life. it's pretty much an alcon x, but for cheaper.",True
ORD423554,ID1492416105,2019-06-01,Thompson,"[('Candle Inferno', 1), ('pearTV', 1)]",6740.0,66.71,-37.8009419,144.9563946,15,5795.71,Winter,True,1.5421,istream doesn't work! this device is not play protect certified. certain apps including istream doesn't appear or work in this phone,False
ORD178275,ID2967254221,2019-05-07,Bakers,"[('Lucent 330S', 1), ('iStream', 1), ('pearTV', 1)]",7690.0,79.49,-37.8106304,145.0055534,25,5846.99,Autumn,True,0.9105,:/ good phone i just got it on monday (3 days ago) but i've dropped it already ://///,True
ORD199453,ID2383211228,2019-06-04,Nickolson,"[('Thunder line', 2), ('Alcon 10', 1), ('pearTV', 1)]",19620.0,62.58,-37.815448,144.96657030000003,0,19682.58,Winter,False,0.4375,"everything worked great, no issues thus far and even though they ... everything worked great, no issues thus far and even though they advertise some dings my phone was in almost new condition. thank you",True
ORD462289,ID1492153105,2019-04-14,Thompson,"[('Candle Inferno', 1), ('Universe Note', 1), ('Lucent 330S', 1)]",5110.0,64.17,-37.8125999,144.9539031,15,4407.67,Autumn,False,0.6011,"excellent phone awesome phone, great battery life best i've ever had with all the phones i have super cool set up 10 thumbs up",True
ORD191096,ID0301537541,2019-04-24,Thompson,"[('Alcon 10', 1), ('pearTV', 1)]",15260.0,65.47,-37.821006,144.9442801,0,15325.47,Autumn,True,0.9595,does not live up to its reputation. customer service at olivia is the worst. phone is horrible. do not buy this phone. the touch response is bad. customer service is horrible at olivia stay away.,False
ORD488622,ID0992113493,2019-01-25,Nickolson,"[('Lucent 330S', 1), ('Candle Inferno', 1), ('Olivia x460', 1)]",2885.0,66.64,-37.8204421,144.96798959999995,25,2230.39,Summer,False,0.2472,"checking it out it looks good so far. my husband, who has had two strokes, is very hard on phones so time will tell.",True
ORD388850,ID3185718970,2019-03-29,Bakers,"[('Thunder line', 1), ('Toshika 750', 1), ('Lucent 330S', 1), ('Candle Inferno', 2)]",8590.0,67.81,-37.7990342,144.98792419999995,5,8228.31,Autumn,False,1.3792,"we purchased this tablet for our son for christmas, to replace a malfunctioning candle inferno 7. we like candle for our kids for the parental controls. so far, this candle has performed fine. he seems happy with it.",True
